{
  "name": "rapid_jam_reset",
  "description": "Parcel jams at pe_002; the operator resets as soon as the alarm latches, restarts, and a follow-up parcel sorts to CHUTE_B.",
  "cell": "sorting_cell_mvp",
  "dt": 0.05,
  "duration": 7.0,
  "events": [
    {"t": 0.0,  "action": "press",        "input": "input.start_pb"},
    {"t": 0.1,  "action": "release",      "input": "input.start_pb"},
    {"t": 0.5,  "action": "spawn_parcel", "id": "P1", "destination": "CHUTE_A"},
    {"t": 2.15, "action": "inject_jam",   "id": "P1"},
    {"t": 3.3,  "action": "press",        "input": "input.reset_pb"},
    {"t": 3.4,  "action": "release",      "input": "input.reset_pb"},
    {"t": 3.6,  "action": "press",        "input": "input.start_pb"},
    {"t": 3.7,  "action": "release",      "input": "input.start_pb"},
    {"t": 3.9,  "action": "spawn_parcel", "id": "P2", "destination": "CHUTE_B"}
  ],
  "expect": {"jam_triggered": true, "jam_cleared": true, "sorted_b": 1}
}
